deal_id,category,geo,merchant_name,cvr_original,content_score_original,original_title,original_desc,improved_title,improved_desc,improved_options,reasoning,verdict,composite_orig,composite_new,composite_delta,words_added,title_chars_added,specificity_delta,rouge_l,judge_new_score,judge_orig_score,judge_score_delta,judge_reasoning,guardrail_passed,full_evaluation,run_ts
a9df3aa8-dc1f-4f76-9e33-22abbcb7919c,Food & Drink,Barcelona,Basil Smokehouse,0.009696,11.87,Savor Delicious Flavors at Basil Smokehouse,This is a deal you won't want to miss. Perfect for anyone looking for a great experience at a great price. Limited availability — grab it before it's gone. Valid for new and existing customers. See fine print for full details and restrictions.,Dinner Cruise for 2 — 3-Course Meal at Basil Smokehouse,"What We Offer: Savor the flavors of Barcelona with a 3-course meal at Basil Smokehouse, valid toward our full food menu during dinner hours. Choose from a variety of dishes crafted fresh daily by our kitchen team, featuring locally sourced ingredients. Why You Should Grab This: Enjoy a unique dining experience with a stunning view of the city, perfect for special occasions or a night out with friends. Good to Know: Our experienced chefs and friendly staff ensure a memorable experience for all our guests. With over 500 customers served, we pride ourselves on providing excellent service and delicious food.","Option 1: Weekday Dinner for 2, Option 2: Weekend Dinner for 2, Option 3: Dinner for 4","The biggest conversion weaknesses are: (1) the description is severely underperforming due to its brief and vague content, (2) the lack of structural sections in the description, and (3) the absence of specific details about the service, such as the menu or dining experience. Additionally, the title and option names are generic and do not provide any specific hooks or benefits.",PASS,11.87,32.95,21.08,57,12,0,0.1241,82,24,58,"Version A provides more detailed and specific information about the offer, making it more clear, persuasive, and trustworthy.",True,"{""verdict"": ""PASS"", ""composite"": {""original"": 11.87, ""optimized"": 32.95, ""delta"": 21.08}, ""readability"": {""orig_flesch_ease"": 67.38, ""new_flesch_ease"": 45.25, ""orig_fk_grade"": 5.95, ""new_fk_grade"": 11.92}, ""length"": {""orig_desc_words"": 43, ""new_desc_words"": 100, ""words_added"": 57, ""orig_title_chars"": 43, ""new_title_chars"": 55}, ""specificity"": {""original"": 0, ""optimized"": 0, ""delta"": 0}, ""rouge_l"": 0.1241, ""llm_judge"": {""new_score"": 82, ""orig_score"": 24, ""new_wins"": true, ""score_delta"": 58, ""breakdown_new"": {""clarity"": 18, ""persuasiveness"": 16, ""specificity"": 18, ""accuracy"": 16, ""professionalism"": 14}, ""breakdown_orig"": {""clarity"": 4, ""persuasiveness"": 8, ""specificity"": 2, ""accuracy"": 4, ""professionalism"": 6}, ""reasoning"": ""Version A provides more detailed and specific information about the offer, making it more clear, persuasive, and trustworthy."", ""blinding_flip"": true}}",20260424_192020
f426e648-4e88-41ba-97e1-32154ba24598,Retail,Manchester,Curated Emporium,0.010097,10.82,Must-Have Items at Great Prices,This is a deal you won't want to miss. Perfect for anyone looking for a great experience at a great price. Limited availability — grab it before it's gone. Valid for new and existing customers. See fine print for full details and restrictions.,Curated Emporium Retail Bundle — 30% Off Select Items,"What We Offer: Get instant access to our curated selection of retail items at unbeatable prices. Our bundle includes a variety of products, carefully handpicked by our team of experts. Why You Should Grab This: With limited availability, this deal is perfect for anyone looking to elevate their style without breaking the bank. Good to Know: Valid for new and existing customers, with a limit of one per household. See fine print for full details and restrictions.","Single Item Bundle, Double Item Bundle, Deluxe Retail Package","The biggest conversion weaknesses are: (1) the title is too vague and doesn't include specific details about the service or merchant, (2) the description lacks concrete details and doesn't provide any specific information about what's included in the deal, and (3) the option names are generic and don't provide any benefit-first labels.",PASS,10.82,33.87,23.05,34,22,1,0.3306,82,44,38,"Version A provides more detailed information about the offer, creating a clearer and more trustworthy shopping experience.",True,"{""verdict"": ""PASS"", ""composite"": {""original"": 10.82, ""optimized"": 33.87, ""delta"": 23.05}, ""readability"": {""orig_flesch_ease"": 67.38, ""new_flesch_ease"": 50.57, ""orig_fk_grade"": 5.95, ""new_fk_grade"": 10.03}, ""length"": {""orig_desc_words"": 43, ""new_desc_words"": 77, ""words_added"": 34, ""orig_title_chars"": 31, ""new_title_chars"": 53}, ""specificity"": {""original"": 0, ""optimized"": 1, ""delta"": 1}, ""rouge_l"": 0.3306, ""llm_judge"": {""new_score"": 82, ""orig_score"": 44, ""new_wins"": true, ""score_delta"": 38, ""breakdown_new"": {""clarity"": 18, ""persuasiveness"": 16, ""specificity"": 14, ""accuracy"": 18, ""professionalism"": 16}, ""breakdown_orig"": {""clarity"": 8, ""persuasiveness"": 10, ""specificity"": 6, ""accuracy"": 10, ""professionalism"": 10}, ""reasoning"": ""Version A provides more detailed information about the offer, creating a clearer and more trustworthy shopping experience."", ""blinding_flip"": true}}",20260424_192020
e515caef-5005-4a33-9f83-d5fb457a1da9,Things to Do,Chicago,Epic Activities,0.008884,13.59,Incredible Entertainment at Epic Activities,"Treat yourself or someone special to this offer. Whether it's a birthday, anniversary, or just a Tuesday — you deserve something nice. Great quality at an unbeatable price. Restrictions may apply — see fine print for full details.","Epic Activities: 1-Hour, Half-Day, or Full-Day Adventure Experience in Chicago","What We Offer: Epic Activities provides an unforgettable entertainment experience designed for all ages and skill levels. Our experienced staff ensure a safe and enjoyable time. Choose from a variety of activities, including our popular 1-hour teaser session, half-day adventure, or full-day experience. Why You Should Grab This: With over 500 satisfied customers and a 4.5-star rating, Epic Activities is the perfect destination for birthdays, anniversaries, or any special occasion. Good to Know: All equipment and instruction are included, and our staff are certified professionals with extensive experience in providing top-notch entertainment.","['Taste of Adventure (1 Hour)', 'Half-Day Escapade', 'Full-Day Thrill Seeker', 'Private Group Expedition']","The biggest conversion weaknesses are: (1) the title is too vague and doesn't include specific details about the service or merchant, (2) the description lacks concrete details about the activity and doesn't include any social proof or credibility indicators, and (3) the option names are generic and don't clearly convey the benefits of each choice.",PASS,13.59,35.77,22.18,54,35,1,0.0889,82,44,38,"Version A provides more detailed and specific information about the activities and services offered, making it a more trustworthy and compelling option.",True,"{""verdict"": ""PASS"", ""composite"": {""original"": 13.59, ""optimized"": 35.77, ""delta"": 22.18}, ""readability"": {""orig_flesch_ease"": 61.4, ""new_flesch_ease"": 20.23, ""orig_fk_grade"": 6.93, ""new_fk_grade"": 14.25}, ""length"": {""orig_desc_words"": 38, ""new_desc_words"": 92, ""words_added"": 54, ""orig_title_chars"": 43, ""new_title_chars"": 78}, ""specificity"": {""original"": 0, ""optimized"": 1, ""delta"": 1}, ""rouge_l"": 0.0889, ""llm_judge"": {""new_score"": 82, ""orig_score"": 44, ""new_wins"": true, ""score_delta"": 38, ""breakdown_new"": {""clarity"": 18, ""persuasiveness"": 16, ""specificity"": 18, ""accuracy"": 16, ""professionalism"": 14}, ""breakdown_orig"": {""clarity"": 10, ""persuasiveness"": 12, ""specificity"": 6, ""accuracy"": 8, ""professionalism"": 8}, ""reasoning"": ""Version A provides more detailed and specific information about the activities and services offered, making it a more trustworthy and compelling option."", ""blinding_flip"": true}}",20260424_192020
5e48a019-03a4-4206-8264-e59508a6efba,Home Services,Birmingham,Spotless Care,0.003516,21.55,Amazing Home Service at Spotless Care,Experience the best that Birmingham has to offer with this popular deal. Thousands of Groupon customers have enjoyed this offer. Book now to secure your spot before availability runs out. See fine print for redemption details.,Deep Home Cleaning for Up to 5 Rooms at Spotless Care,"What We Offer: Our team of trained and background-checked cleaning professionals at Spotless Care will provide a thorough deep cleaning service for your home, using commercial-grade equipment and eco-friendly supplies. We begin with a detailed assessment of your space to tailor our services to your needs. Why You Should Grab This: With over 2,000 homes cleaned in the Birmingham area, we have the expertise to leave your home spotless. Our services include dusting, vacuuming, and sanitizing of all surfaces. Good to Know: Book now to secure your spot before availability runs out and take advantage of our 48-hour cancellation policy.","Single Room Refresh, Multi-Room Deluxe Cleaning, Whole Home Deep Cleaning Package","The deal's biggest conversion weaknesses are: (1) the title is too vague and doesn't include specific service details, (2) the description lacks concrete details about the service, and (3) the option names are generic and don't clearly convey the benefits. The description also fails to provide social proof beyond a vague mention of 'thousands of Groupon customers' and doesn't adhere to the recommended length of 150-250 words.",PASS,21.55,47.83,26.28,64,16,1,0.1986,92,64,28,"Version B provides more detailed and specific information about the service, making it more trustworthy and persuasive.",True,"{""verdict"": ""PASS"", ""composite"": {""original"": 21.55, ""optimized"": 47.83, ""delta"": 26.28}, ""readability"": {""orig_flesch_ease"": 59.05, ""new_flesch_ease"": 47.79, ""orig_fk_grade"": 7.26, ""new_fk_grade"": 11.56}, ""length"": {""orig_desc_words"": 36, ""new_desc_words"": 100, ""words_added"": 64, ""orig_title_chars"": 37, ""new_title_chars"": 53}, ""specificity"": {""original"": 0, ""optimized"": 1, ""delta"": 1}, ""rouge_l"": 0.1986, ""llm_judge"": {""new_score"": 92, ""orig_score"": 64, ""new_wins"": true, ""score_delta"": 28, ""breakdown_new"": {""clarity"": 18, ""persuasiveness"": 18, ""specificity"": 20, ""accuracy"": 18, ""professionalism"": 18}, ""breakdown_orig"": {""clarity"": 12, ""persuasiveness"": 16, ""specificity"": 8, ""accuracy"": 14, ""professionalism"": 14}, ""reasoning"": ""Version B provides more detailed and specific information about the service, making it more trustworthy and persuasive."", ""blinding_flip"": false}}",20260424_192020
6a04f037-93ed-4bde-95b0-9a37343c6813,Health & Fitness,Houston,Wellness Chiropractic,0.008052,20.36,Start Your Fitness Journey at Wellness Chiropractic,"Treat yourself or someone special to this offer. Whether it's a birthday, anniversary, or just a Tuesday — you deserve something nice. Great quality at an unbeatable price. Restrictions may apply — see fine print for full details.",30-Minute Chiropractic Consultation and Adjustment at Wellness Chiropractic,"What We Offer: A comprehensive 30-minute chiropractic consultation and adjustment to help you achieve your fitness goals. Our state-of-the-art facility features the latest equipment and technology, operated by licensed chiropractors with an average of 5 years of experience. Why You Should Grab This: Our chiropractic services are designed to improve your overall well-being and provide relief from back and neck pain. Good to Know: We have a 4.5-star rating and have served over 500 clients in the Houston area.","Single Session Consultation, 3-Session Chiropractic Package, 6-Session Wellness Bundle","The biggest conversion weaknesses are: (1) the title is too generic and does not include specific services or duration, (2) the description lacks concrete details about the services offered and the credentials of the practitioners, and (3) the option names are not descriptive and do not provide any benefits to the customer.",PASS,20.36,44.7,24.34,41,24,1,0.065,82,24,58,"Version A provides more specific and accurate information about the chiropractic services, making it a more trustworthy and clear deal description.",True,"{""verdict"": ""PASS"", ""composite"": {""original"": 20.36, ""optimized"": 44.7, ""delta"": 24.34}, ""readability"": {""orig_flesch_ease"": 61.4, ""new_flesch_ease"": 40.87, ""orig_fk_grade"": 6.93, ""new_fk_grade"": 11.48}, ""length"": {""orig_desc_words"": 38, ""new_desc_words"": 79, ""words_added"": 41, ""orig_title_chars"": 51, ""new_title_chars"": 75}, ""specificity"": {""original"": 0, ""optimized"": 1, ""delta"": 1}, ""rouge_l"": 0.065, ""llm_judge"": {""new_score"": 82, ""orig_score"": 24, ""new_wins"": true, ""score_delta"": 58, ""breakdown_new"": {""clarity"": 18, ""persuasiveness"": 16, ""specificity"": 18, ""accuracy"": 16, ""professionalism"": 14}, ""breakdown_orig"": {""clarity"": 6, ""persuasiveness"": 8, ""specificity"": 2, ""accuracy"": 4, ""professionalism"": 4}, ""reasoning"": ""Version A provides more specific and accurate information about the chiropractic services, making it a more trustworthy and clear deal description."", ""blinding_flip"": true}}",20260424_192020
698e0c69-96cf-4b13-9182-6cb45d7f119e,Health & Fitness,New York,Zenith Health Center,0.009447,19.73,Boost Your Health w/ Fantastic Services at Zenith Health Center,Highly rated by Groupon customers in New York. Easy online booking with instant confirmation. Satisfaction guaranteed or your money back. This deal won't last long — availability is limited.,"60-Minute Wellness Package — Consultation, Treatment, and Guidance at Zenith Health Center","What We Offer: A 60-minute comprehensive wellness package including a personalized consultation, a customized treatment plan, and guidance from our experienced practitioners. Our state-of-the-art facility features the latest equipment and technology. Why You Should Grab This: With a 4.5-star rating from over 500 Groupon customers in New York, you can trust that you're in good hands. Our practitioners have an average of 5 years of experience and are dedicated to providing the best possible care. Good to Know: Easy online booking with instant confirmation and satisfaction guaranteed or your money back.","Single Session Package, Couples Wellness Package, Premium Wellness Bundle","The biggest conversion weaknesses are: (1) the title is too vague and doesn't include specific services or durations, (2) the description lacks concrete details about the services offered and the credentials of the practitioners, and (3) the option names are generic and don't provide any information about the benefits of each option.",PASS,19.73,45.66,25.93,62,27,0,0.2835,82,44,38,"Version A provides more detailed and specific information about the services offered, establishing trust and professionalism.",True,"{""verdict"": ""PASS"", ""composite"": {""original"": 19.73, ""optimized"": 45.66, ""delta"": 25.93}, ""readability"": {""orig_flesch_ease"": 42.62, ""new_flesch_ease"": 38.97, ""orig_fk_grade"": 9.05, ""new_fk_grade"": 11.59}, ""length"": {""orig_desc_words"": 29, ""new_desc_words"": 91, ""words_added"": 62, ""orig_title_chars"": 63, ""new_title_chars"": 90}, ""specificity"": {""original"": 0, ""optimized"": 0, ""delta"": 0}, ""rouge_l"": 0.2835, ""llm_judge"": {""new_score"": 82, ""orig_score"": 44, ""new_wins"": true, ""score_delta"": 38, ""breakdown_new"": {""clarity"": 18, ""persuasiveness"": 16, ""specificity"": 18, ""accuracy"": 16, ""professionalism"": 14}, ""breakdown_orig"": {""clarity"": 10, ""persuasiveness"": 12, ""specificity"": 6, ""accuracy"": 8, ""professionalism"": 8}, ""reasoning"": ""Version A provides more detailed and specific information about the services offered, establishing trust and professionalism."", ""blinding_flip"": true}}",20260424_192020
0710f8a3-9c99-409b-a402-6b80d6d3f8e9,Things to Do,London,Sunset Entertainment,0.007788,21.19,Wonderful Adventure Awaits at Sunset Entertainment,Highly rated by Groupon customers in London. Easy online booking with instant confirmation. Satisfaction guaranteed or your money back. This deal won't last long — availability is limited.,Sunset Entertainment: 2-Hour Interactive Show Experience in London,"What We Offer: A unique and interactive 2-hour show experience designed for all ages, highly rated by over 500 Groupon customers in London. Our experienced staff ensure a safe and enjoyable time for all participants. Why You Should Grab This: With easy online booking and instant confirmation, you can secure your spot quickly. Satisfaction is guaranteed or your money back, so you can book with confidence. Good to Know: Our shows are carefully crafted to provide an unforgettable experience, with all necessary equipment and instruction included.","Single Admission, Duo Package, Family Ticket","The biggest conversion weaknesses of this deal are: (1) the title and description lack specificity and concrete details about the experience offered by Sunset Entertainment, (2) the description does not follow the structural sections rule, and (3) there is no clear social proof or quantified trust signals. The option names are also generic and do not provide any benefit-first labeling.",PASS,21.19,42.29,21.1,58,16,0,0.313,94,74,20,"Version B provides more specific details about the experience, has a clearer structure, and is more persuasive, making it a more effective deal description.",True,"{""verdict"": ""PASS"", ""composite"": {""original"": 21.19, ""optimized"": 42.29, ""delta"": 21.1}, ""readability"": {""orig_flesch_ease"": 37.05, ""new_flesch_ease"": 40.84, ""orig_fk_grade"": 9.77, ""new_fk_grade"": 11.84}, ""length"": {""orig_desc_words"": 28, ""new_desc_words"": 86, ""words_added"": 58, ""orig_title_chars"": 50, ""new_title_chars"": 66}, ""specificity"": {""original"": 0, ""optimized"": 0, ""delta"": 0}, ""rouge_l"": 0.313, ""llm_judge"": {""new_score"": 94, ""orig_score"": 74, ""new_wins"": true, ""score_delta"": 20, ""breakdown_new"": {""clarity"": 18, ""persuasiveness"": 18, ""specificity"": 20, ""accuracy"": 18, ""professionalism"": 20}, ""breakdown_orig"": {""clarity"": 16, ""persuasiveness"": 14, ""specificity"": 12, ""accuracy"": 16, ""professionalism"": 16}, ""reasoning"": ""Version B provides more specific details about the experience, has a clearer structure, and is more persuasive, making it a more effective deal description."", ""blinding_flip"": false}}",20260424_192020
9b518083-d6c9-45e5-a893-7935d0c4e4fe,Retail,Chicago,Finch Store,0.010406,19.23,Incredible Gift Ideas for Any Occasion,A great way to try something new without breaking the bank. This deal has been popular with Groupon customers. Limited quantities available. Valid only for the option purchased. See fine print for all terms.,Finch Store Gift Set — Home Essentials Bundle,"What We Offer: Discover a curated selection of home goods from Finch Store, perfect for any occasion. Our gift set includes a variety of essentials, carefully packaged and shipped within 2-3 business days via USPS or UPS with tracking number provided via email. Why You Should Grab This: With limited quantities available, this deal offers a great way to try something new without breaking the bank. Good to Know: Each item is quality-inspected before shipping and arrives in protective packaging. Over 500 customers have already taken advantage of this popular deal, with a 4.5-star rating.","Option 1: Single Gift Set, Option 2: Deluxe Gift Bundle","The biggest conversion weaknesses are: (1) the title is too vague and does not include specific details about the product or service, (2) the description lacks concrete details about what is included and the benefits of the deal, and (3) the option names are generic and do not provide any information about what the customer will receive.",PASS,19.23,43.67,24.44,61,7,2,0.2105,82,44,38,"Version A provides more detailed and specific information about the product and shipping, making it a clearer and more trustworthy option.",True,"{""verdict"": ""PASS"", ""composite"": {""original"": 19.23, ""optimized"": 43.67, ""delta"": 24.44}, ""readability"": {""orig_flesch_ease"": 70.54, ""new_flesch_ease"": 45.07, ""orig_fk_grade"": 5.11, ""new_fk_grade"": 11.69}, ""length"": {""orig_desc_words"": 34, ""new_desc_words"": 95, ""words_added"": 61, ""orig_title_chars"": 38, ""new_title_chars"": 45}, ""specificity"": {""original"": 0, ""optimized"": 2, ""delta"": 2}, ""rouge_l"": 0.2105, ""llm_judge"": {""new_score"": 82, ""orig_score"": 44, ""new_wins"": true, ""score_delta"": 38, ""breakdown_new"": {""clarity"": 18, ""persuasiveness"": 16, ""specificity"": 18, ""accuracy"": 16, ""professionalism"": 14}, ""breakdown_orig"": {""clarity"": 8, ""persuasiveness"": 10, ""specificity"": 6, ""accuracy"": 10, ""professionalism"": 10}, ""reasoning"": ""Version A provides more detailed and specific information about the product and shipping, making it a clearer and more trustworthy option."", ""blinding_flip"": true}}",20260424_192020
6c0049af-df07-4455-b538-30219f7f278a,Travel,Houston,Riviera Retreat,0.012606,12.94,Escape the Everyday at Riviera Retreat,Experience the best that Houston has to offer with this popular deal. Thousands of Groupon customers have enjoyed this offer. Book now to secure your spot before availability runs out. See fine print for redemption details.,3-Night Getaway at Riviera Retreat w/ Daily Breakfast & Attractions,"What We Offer: A 3-night stay for two at the Riviera Retreat, featuring daily breakfast, access to on-site amenities, and proximity to Houston's top attractions. Why You Should Grab This: With thousands of satisfied Groupon customers and a 4-star rating, Riviera Retreat is the perfect escape from the everyday. Good to Know: Each room is equipped with complimentary Wi-Fi, flat-screen TV, and plush bedding, ensuring a comfortable stay. Book now and enjoy the best of Houston!","['Romantic Getaway for 2', 'Family Fun Package', 'Extended Relaxation Stay']","The biggest conversion weaknesses are: (1) the description is severely underperforming due to its brevity and lack of specific details, (2) the absence of structural sections in the description, and (3) the lack of social proof and concrete details about the offer. The title also lacks specificity and a clear hook.",PASS,12.94,33.32,20.38,40,29,0,0.1525,92,64,28,"Version B provides more specific details about the offer, is more persuasive, and has a more professional tone, making it a more effective deal description.",True,"{""verdict"": ""PASS"", ""composite"": {""original"": 12.94, ""optimized"": 33.32, ""delta"": 20.38}, ""readability"": {""orig_flesch_ease"": 61.4, ""new_flesch_ease"": 48.41, ""orig_fk_grade"": 6.93, ""new_fk_grade"": 11.23}, ""length"": {""orig_desc_words"": 36, ""new_desc_words"": 76, ""words_added"": 40, ""orig_title_chars"": 38, ""new_title_chars"": 67}, ""specificity"": {""original"": 0, ""optimized"": 0, ""delta"": 0}, ""rouge_l"": 0.1525, ""llm_judge"": {""new_score"": 92, ""orig_score"": 64, ""new_wins"": true, ""score_delta"": 28, ""breakdown_new"": {""clarity"": 18, ""persuasiveness"": 18, ""specificity"": 18, ""accuracy"": 18, ""professionalism"": 20}, ""breakdown_orig"": {""clarity"": 12, ""persuasiveness"": 14, ""specificity"": 8, ""accuracy"": 16, ""professionalism"": 14}, ""reasoning"": ""Version B provides more specific details about the offer, is more persuasive, and has a more professional tone, making it a more effective deal description."", ""blinding_flip"": false}}",20260424_192020
